{
    "$schema": "../schema/template.schema.json",
    "variables": {
    },
    "name": "default",
    "copy": [
        {
            "from": "package.json.tpl",
            "to": "package.json",
            "templated": true
        },
        {
            "from": "README.md",
            "to": "README.md",
            "templated": true
        },
        {
            "from": "src",
            "to": "src"
        },
        {
            "from": "test",
            "to": "test"
        },
        ".editorconfig",
        ".gitignore",
        ".npmignore",
        "tsconfig.json",
        "tsconfig.build.json"
    ],
    "generate": [
        "src",
        "typings"
    ],
    "build": [
        "builder.js",
        {
            "builder": "builder.js",
            "params": {
                "a": true,
                "b": 3,
                "c": "some stuff"
            }
        },
        {
            "builder": "builder.js",
            "params": {
                "return": true
            }
        }
    ]
}
